{
  "schema_version": 1,
  "request_id": "request-pair-7-9",
  "group_id": "pair-7-9",
  "participants": [
    { "agent_id": 7, "role": "initiator", "retarget_profile_id": "reference-humanoid" },
    { "agent_id": 9, "role": "responder", "retarget_profile_id": "reference-humanoid" }
  ],
  "tick_start": 10,
  "tick_end": 20,
  "seed": 2026,
  "mode": "strict",
  "action": "approach-and-touch",
  "outcome": "touch-then-separate",
  "root_constraints": [
    { "agent_id": 7, "samples": [
      { "tick": 10, "position": [0.0, 0.0, 0.0], "yaw": 0.0 },
      { "tick": 20, "position": [0.5, 0.0, 0.0], "yaw": 0.0 }
    ] },
    { "agent_id": 9, "samples": [
      { "tick": 10, "position": [1.0, 0.0, 0.0], "yaw": 3.141592653589793 },
      { "tick": 20, "position": [0.5, 0.0, 0.0], "yaw": 3.141592653589793 }
    ] }
  ],
  "contact_constraints": [
    { "contact_id": "touch-7-9", "owner_agent_id": 7, "other_agent_id": 9, "label": "touch", "tick_start": 14, "tick_end": 16, "required": true },
    { "contact_id": "separate-7-9", "owner_agent_id": 7, "other_agent_id": 9, "label": "forbidden", "tick_start": 19, "tick_end": 20, "required": false }
  ],
  "provenance": {
    "base_cache_hash": "b2c74ec5a6038dc1761afdcb727f756b092ad64113aeeed3a9c5e14611c138d7",
    "graph_hash": "bbbbbbbbbbbbbbbbbbbbbbbbbbbbbbbbbbbbbbbbbbbbbbbbbbbbbbbbbbbbbbbb",
    "worker_protocol": "authored-paired-clip-v1"
  },
  "budgets": { "max_latency_ms": 20, "max_memory_bytes": 1048576, "max_output_bytes": 1048576 }
}
